title,summary,text,published,source
Clinical trials changing lives: one researcher's story,"<p>Professor Matt Sydes, Head of Data-Driven Clinical Trials at NHS England, describes how his personal and professional lives collided when a family member was affected by a rare cancer.</p>

<p>As a statistician and a trialist, I've been involved with researching many different diseases and conditions over the years. I’ve planned and run studies, analysed data, and interpreted and disseminated findings from clinical trials to support the development of new treatments and interventions, all to help doctors and patients make the best healthcare decisions that improve and extend lives.</p>","Digital As a statistician and a trialist, I've been involved with researching many different diseases and conditions over the years. I’ve planned and run studies, analysed data, and interpreted and disseminated findings from clinical trials to support the development of new treatments and interventions, all to help doctors and patients make the best healthcare decisions that improve and extend lives. In my roles I don’t interact directly with the participants in trials, but I always think about their contribution in the research and the data they provide. Having this perspective is one of the reasons I agreed to serve on the Ethics Committee and research funding panels. It’s why I chose to be randomised as a healthy member of the public into the INTERVAL trial of blood donation frequency and why, like millions of others, I take part in research through Our Future Health. I always figured at some point I’d be up close and personal to the participation side of randomised controlled trial of treatments, but it happened sooner than I expected and in a very different way. When my son was a teenager, he developed a lump on his back. On examination, our local GP immediately sent him for further tests. I’d just finished teaching a course in Edinburgh and was heading home to Cambridgeshire when I got a call from my wife telling me to come directly to the hospital where our son had been admitted. Those tests led to the news no parent ever wants to hear: our son had a rare, life-threatening cancer. The world crashed around us all. This was about a decade ago and, as a spoiler alert, he’s doing great. When he was diagnosed, there was a randomised controlled trial open to test interventions for people with his condition. I knew this because, in an awful coincidence, his cancer was in an area I had been involved with researching for the past 10 years. My son was old enough to drive decisions about whether to participate, but not legally old enough to sign his own consent form. I would have supported his decision either way, but I’m proud he chose to participate, knowing that it might help people like him in the future but not necessarily him directly. One scary Saturday afternoon, as we all sat together in the paediatric ward with his oncologist, I signed the consent form for his participation. Like many clinical trials in real life, this wasn’t testing a bright and shiny new drug. It was a trial looking at which existing treatment regime would be more effective to treat his condition. The approach more commonly used in Europe was being compared to the approach more commonly used in North America. Both treatments were known to work well for many (but not all) people. Both would involve 8 months of treatment with chemotherapy, radiotherapy and surgery, and about 100 nights in hospital. We had no idea if the regime my son was allocated to would be the one which proved more effective or not, we just hoped he would do well – and the data would help others. My son ","Mon, 19 May 2025 10:14:35 GMT",https://digital.nhs.uk/blog/data-points-blog/2025/clinical-trials-changing-lives-one-researchers-story
Making sure the NHS App works for everyone,"<p>Simon Davis explains how the NHS App team puts users at the heart of digital delivery design by considering accessibility needs at every stage of the user research process.</p>

<p>As the lead user researcher for the NHS App, my role is to ensure users remain at the centre of everything we do. I work with a talented team of researchers across different departments, engaging with both the public and frontline NHS staff to understand their experiences with our services.</p>","Digital As the lead user researcher for the NHS App, my role is to ensure users remain at the centre of everything we do. I work with a talented team of researchers across different departments, engaging with both the public and frontline NHS staff to understand their experiences with our services. We're not just interested in what users want – we need to understand the outcomes they're trying to achieve and identify any barriers preventing them from reaching those goals. We’re interested in what users need from our NHS App service. We have recruited users with access needs in community-based research, research with charities and local NHS teams, and in remote research, either one to one or in groups.  Through methods like usability testing, interviews, and card sorting (where participants group and organise content topics to help us understand how they categorise information), we gather valuable insights on both the existing app and prototypes of future developments. Accessibility isn't an afterthought for us – it's built into our process from the beginning. We've set a target that every user research round must include at least one participant with access needs, whether cognitive, visual, physical or auditory. This approach is crucial because it allows us to identify potential barriers early in development. More importantly, it ensures the NHS App genuinely works for all our users. When accessibility is woven into every stage of development, we create a more inclusive service that benefits everyone, including those who may not identify as having an access need but still gain from clearer navigation, simpler language, and more intuitive design. Currently, we're conducting research with people who have rheumatoid arthritis, in collaboration with the National Rheumatoid Arthritis Society (NRAS), as they may struggle with the dexterity required for certain touch interactions on a smartphone. We also have upcoming sessions planned with the Royal National Institute of the Blind (RNIB) and individuals with users who are blind or partially sighted. Our screening processes and surveys are specifically designed to identify participants with diverse accessibility requirements. Working closely with designers is particularly important in our accessibility efforts. We ensure they're informed by our research findings, and we collaborate around designs so we can build appropriate user research around it. We regularly feed accessibility insights back to our design system team, ensuring that the components they create – which all other teams in the NHS App will use – work for users with accessibility needs right from the start. One concrete example of how our accessibility research has made a difference is with the direct appointment booking feature. Our research showed that breaking down multiple questions into separate pages makes completion easier for many users, particularly those using screen readers or with cognitive access needs. We're constantly working ","Wed, 14 May 2025 12:31:18 GMT",https://digital.nhs.uk/blog/design-matters/2025/making-sure-the-nhs-app-works-for-everyone
How to stay one step ahead of a cyber attack,"<p>Ryan Lee explains how our Threat Operations team use a unique network of intelligence and techniques to detect advanced cyber threats before they can cause harm – and what everyone working in the NHS should do to help.</p>

<p>If you worked for the NHS 10 years ago, you would have heard cyber security spoken about quite differently. It was often seen as an IT issue, lumped into conversations about software updates and internet usage. Now, <a href=""https://digital.nhs.uk/feed/cyber-security-is-a-patient-safety-issue"">cyber is rightly understood to be a patient safety issue</a>.</p>

<p>As the cyber threat has become more sophisticated, so has our cyber security approach for the NHS. We have evolved significantly in recent years in response to the growing threat. My team’s specialist work in threat operations is one example of this, and just one part of our central cyber security defence approach.</p>","Digital If you worked for the NHS 10 years ago, you would have heard cyber security spoken about quite differently. It was often seen as an IT issue, lumped into conversations about software updates and internet usage. Now, cyber is rightly understood to be a patient safety issue. As the cyber threat has become more sophisticated, so has our cyber security approach for the NHS. We have evolved significantly in recent years in response to the growing threat. My team’s specialist work in threat operations is one example of this, and just one part of our central cyber security defence approach. The NHS is one of the world’s largest employers and holds some of the world’s largest IT infrastructure. NHSmail is Microsoft’s largest Office 365 tenant, and within our security tooling we encompass around 5.6 million devices. Every single one holds the potential to access sensitive data, which is essential for NHS colleagues to do their jobs, and valuable to those who may wish to do us harm. This vast network is what makes the NHS so attractive to cyber criminals, who can range from advanced cybercrime and more sophisticated threat groups operating across the globe, to opportunistic hackers simply looking for weaknesses to exploit. Whether the motive is disruption, profit, or something else entirely, cyber attacks have the potential to halt patient care or damage public trust in us to safeguard their data. This means we must stay one step ahead of the attackers to make sure that ambulances can pick up patients, that clinical operations happen, that people can get a GP appointment when they need one, and so much more. Our Threat Operations team specialises in the detection of cyber security threats to UK health and social care. Our mission is to proactively detect and inform on advanced cyber threats before they can cause harm to our organisations. Threat operations consists of 2 pillars  – threat intelligence and threat hunting – which produce an array of specialist, threat-led capabilities to enhance security monitoring and response. Our dedicated threat intelligence team has built up a robust network of intelligence sources. We continually analyse this intelligence to identify new and developing threats to the healthcare system. We share our findings with leaders and technical teams throughout the NHS to help us respond collectively. Think of us as knowledgeable partners, here to help individual NHS organisations make the best cyber security decisions. To gather the best intelligence, we centrally inject intelligence feeds into our security tools, generated from commercial, curated open source, and our own bespoke threat intelligence insights. We also provide darknet and credential compromise monitoring and undertake intense study of how threat actors are operating. To share our findings, we offer the healthcare system strategic products and tactical intelligence, and advice on the best ways to mitigate emerging threats and use modelling tools to predict ","Wed, 04 Jun 2025 07:36:03 GMT",https://digital.nhs.uk/blog/transformation-blog/2024/how-to-stay-one-step-ahead-of-a-cyber-attack
How we’re modernising electronic prescribing,"<p>Most prescriptions are still paper-based in secondary care. Business analyst Andy Harrison describes the technical groundwork we’ve laid to allow these settings to go digital.</p>

<p>The little green FP10 paper prescriptions have all but disappeared in primary care. 18 years ago, we <a href=""https://webarchive.nationalarchives.gov.uk/ukgwa/20250507055553/https://digital.nhs.uk/features"">launched the Electronic Prescription Service</a> (EPS)&nbsp;and it has since become an indispensable tool for primary care teams. Nearly all GP practices use it and about 95% of primary care prescriptions are now sent electronically. Last year, that amounted to 1 billion items dispensed using the service. It’s a safer, faster and more convenient way to prescribe.</p>","Digital The little green FP10 paper prescriptions have all but disappeared in primary care. 18 years ago, we launched the Electronic Prescription Service (EPS) and it has since become an indispensable tool for primary care teams. Nearly all GP practices use it and about 95% of primary care prescriptions are now sent electronically. Last year, that amounted to 1 billion items dispensed using the service. It’s a safer, faster and more convenient way to prescribe. But despite all our gains in primary care, there are only a handful of secondary care providers who currently use the service. Patients who require secondary care prescriptions sometimes need to travel to outpatient clinics to collect them, and it’s not unheard of for clinicians to have to drop off paper prescriptions in person. But before secondary care providers can start using it, we had to modernise: the underlying technology of EPS hadn’t changed much since it was launched in 2005. In 2020, we began to move EPS from the HL7v3 data standard to the Fast Healthcare Interoperability Resources (FHIR) standard, as a significant first step in modernising the EPS platform in England. The aim of this project was to improve interoperability by enabling more efficient and accurate processing of electronic prescriptions through the exchange of more detailed and structured clinical information between the electronic prescribing and medicines administration (EPMA) systems used in secondary care and EPS. This improves patient safety and ensures healthcare providers have access to accurate information. In the first stage, this modernisation has taken the form of a FHIR façade, which sits in front of the HL7v3 service and allows suppliers to interact with EPS in FHIR in the same way they do in HL7v3. This means suppliers will be able to use HL7v3 and FHIR interchangeably. For example, a prescriber can create a prescription with HL7v3 and a dispenser can release that prescription in FHIR. The expertise of the interoperability team has helped in moving from HL7v3 to FHIR. This included modelling the interactions within EPS using FHIR resources, mapping all data elements required in the HL7v3 Message Implementation Manual (MIM) to data elements in FHIR and creating an implementation guide to be used by both suppliers and the EPS programme in developing the FHIR façade. Development work on the FHIR façade for EPS is now complete with the first supplier ready to go live imminently. ‘First of type’ suppliers are currently assessing their capability against the EPS Supplier Conformance Assessment List (SCAL). Once the FHIR API is released, any new system suppliers that wish to connect to EPS will be onboarded with the FHIR API as part of their onboarding process with the NHS. The onboarding process involves demonstrating that they can communicate with the EPS FHIR API and can consume and interpret FHIR messages correctly. The EPS team is continuing to expand the capability within EPS to support dental prescr","Thu, 17 Jul 2025 14:32:05 GMT",https://digital.nhs.uk/blog/tech-talk/2023/how-were-modernising-electronic-prescribing
Our new approach to migrating Spine to the cloud,"<p>Mark Burton, Lead Delivery Manager for the Spine Futures programme, explains why we’re accelerating the migration of Spine services into the cloud and why we need NHS organisations and healthcare suppliers to support the move.</p>

<p>In the decade since the <a href=""https://digital.nhs.uk/feed/spine-copy-test"">NHS Spine</a>&nbsp;was launched, digital health and care services have become significantly larger, much more complex and more central to NHS provision. The Spine platform provides critical healthcare infrastructure and we must modernise to keep up with the demands being placed on it.</p>","Digital In the decade since the NHS Spine was launched, digital health and care services have become significantly larger, much more complex and more central to NHS provision. The Spine platform provides critical healthcare infrastructure and we must modernise to keep up with the demands being placed on it. I’ve previously talked about how migrating NHS Spine to the cloud will provide a secure, adaptable, and sustainable infrastructure for the health and care system. But this is a huge undertaking: it will be one of the largest cloud migrations that the NHS has ever undertaken. My team’s challenge is how to migrate Spine’s 36 national services to the cloud. They are hosted on more than 360 servers across 2 UK datacentres and contain more than 1.2 petabytes of data. The migration must be achieved with zero down-time to ensure availability and continuity of services for all end users. Back in April 2022, when the Spine Futures programme began, our initial plan was to migrate each Spine service to the cloud, transforming it where appropriate, to make best use of cloud technology and build independence between products and services.  The Message Exchange for Social Care and Health (MESH) service was the first migration using this approach, and it went live in December last year. MESH was chosen as a relatively simple service, with minimal dependencies on other Spine systems. However, MESH proved significantly more challenging and complex than was first thought and continuing this approach for the remaining services would not be achievable within the 3-year programme. In order to reduce the risk of multiple complex transition steps for each Spine product and accelerate the move to cloud, we plan on migrating all services together in one go and re-hosting them into AWS (Amazon Web Service) to run in EC2 instances. The live services cut over is due to start in October and conclude in early November 2023.  Once migrated, we will have opportunity to optimise Spine in the cloud and leverage the benefits of cloud native tools to help decouple and improve the services. Early in the planning phase of the migration we agreed 2 simple, but fundamental principles that we need to follow for the migration to be successful: NHS Spine is a critical national service that health and care organisations depend on. To help ensure a successful migration to AWS Cloud, we have planned a 2-month period of connectivity and regression testing, starting on 1 July until 31 August 2023. This will be undertaken in the Spine integration environment. We’re asking connecting organisations to take part and test their application’s connectivity and message responses to assure that there is no impact to the organisation or their customers. Organisations should validate that their applications can continue to connect to Spine and that inbound messages and receipt of outbound asynchronous messages are unaffected. Testing should include services like Personal Demographic Service (PDS), Sum","Thu, 10 Jul 2025 09:35:57 GMT",https://digital.nhs.uk/blog/tech-talk/2023/our-new-approach-to-migrating-spine-to-the-cloud
What does good look like for APIs?,"<p>Matthew Firth describes our best practice policies around APIs – and how the most important one is not about the technical aspects of the work.</p>

<p>For the past 3 years, we have been on a mission to <a href=""https://digital.nhs.uk/feed/api-management-vision_1#our-mission"">make integration easier</a>&nbsp;within the NHS for people building healthcare technology.</p>","Digital For the past 3 years, we have been on a mission to make integration easier within the NHS for people building healthcare technology. To that end, we have: We have made lots of progress, but there is more to do. Quality is an ongoing challenge. We have had a lot of great feedback from API consumers, so we know what a good API looks like, and have a clear set of API principles. But each API is built and run by a different team, and making sure everybody plays by the same rules is never easy. Making the case to improve existing APIs is especially tough. Change must be funded, and funding requires a business case. To help API teams build that case, we’ve published a set of API policies and best practice guidelines to ensure our APIs provide a consistent user experience and give API consumers the confidence that they are built to a high quality. All new and existing NHS England APIs must comply with these policies. The policies might not be what you would expect. You might think they would focus solely on technical aspects of APIs, such as REST, OAuth 2.0 and FHIR. But conforming to technical standards is only one of the 9 policies. These policies build upon and extend central government API technical and data standards. The last policy, having an empowered product owner, is really important to us. Having a person who cares about an API, and who has the budget and resources to improve it, is an essential foundation for all the other policies. Defining these policies also allows us to measure progress against them for our existing APIs, some of which pre-date the API platform. For example: As you can see, we are doing better on some measures than on others. It is our intention that by publishing these figures, and working with our API delivery teams and those who build healthcare software, we will continue to drive change. And that by working with our empowered product owners, we will improve the experience of those software development organisations wanting to integrate with us. The above statistics might be somewhat reductionist, but hopefully we can use them to drive positive change from within. We want to avoid producing complex dashboards that are time-consuming to maintain and ultimately don’t help us measure our progress.     Feedback from API consumers is also essential, so if there is anything specific you would like to see us do, tell us about it via our Developer Community.  Most prescriptions are still paper-based in secondary care. Business analyst Andy Harrison describes the technical groundwork we’ve laid to allow these settings to go digital. Mark Burton, Lead Delivery Manager for the Spine Futures programme, explains why we’re accelerating the migration of Spine services into the cloud and why we need NHS organisations and healthcare suppliers to support the move. Thasmim Ali, Product Owner of our API Developer Community, talks about how we’ve improved support for teams integrating with our products and services – and outlines ","Thu, 10 Jul 2025 16:07:04 GMT",https://digital.nhs.uk/blog/tech-talk/2023/what-does-good-look-like-for-apis
