title,summary,text,published,source
Failure isn’t the end – it’s where better services begin,"<p>Liz Glidewell explains why failing a GDS service assessment is a normal part of the improvement process – and how she supported the Be Part of Research team through multiple assessments to build a better, more accessible service for their users.</p>

<p>Government and NHS services have a duty to work for everyone, including those with low digital confidence and non-digital users. This is why services need to pass a <a href=""https://www.gov.uk/service-manual/service-assessments"">GDS service assessment</a>.</p>

<p>It’s not unusual for a service to fail its first assessment. But what happens next?</p>","Digital Government and NHS services have a duty to work for everyone, including those with low digital confidence and non-digital users. This is why services need to pass a GDS service assessment. It’s not unusual for a service to fail its first assessment. But what happens next? For the teams involved, it can be tough. While we understand that failing is a source of learning, often there is emotional baggage attached to the term. Many of us feel fear and shame when we ‘fail’ at something, which can limit what we go on to achieve. That’s why I embrace ‘failing higher’ – failing smarter and faster – in my role as a GDS assessor. Failing an assessment does not mean we give up on the service. Instead, it’s an important part of the improvement process. Service assessors give teams constructive, actionable feedback, grounded in the principles of user-centred design (UCD). This supports service teams to iterate and create a better service for everyone. A great example is Be Part of Research (BPOR), which aims to make it easier for health researchers and potential study participants to find one another. Briefly, the BPOR team built a website where researchers could register their studies, making them searchable by the public. The public, in turn, learn more about research projects and can apply to participate. Their first beta service assessment took place in March 2022, but it took 2 more reassessments before the team met all service standards in October 2024. I was part of the assessment team for the second and third assessments. This is how we supported the BPOR team to 'fail higher' and ultimately create a service that better met the needs of all its users. Designing services for a group as diverse as ‘the public’ is challenging. We need to identify all our users and gain a deep understanding of their needs. This is the heartbeat of user centred design.   It is important to map all users who interact with our services, not just end users. Initially, the team conducted research with ‘healthy volunteers’ who prioritised online journeys and also user groups with complex co-morbidities and their carers. They also included public health and social care participants and researchers. They identified their needs to maximise uptake in studies. The team went beyond sampling people with different levels of digital literacy to recognise people ‘under-served by research’, such as those with: The team sampled and screened for these characteristics to build confidence in their findings.   People want seamless journeys. We need to understand users’ needs across their end-to-end journey.   Following assessment, the team mapped out the end-to-end user journey for all their users. They introduced: Users can now learn about research, register, manage their experience and receive study results via the channel works for them, including online, phone, paper or in person. This ensured an equitable experience for everyone. We expect services to work seamlessly, whether we’r","Fri, 12 Sep 2025 12:50:12 GMT",https://digital.nhs.uk/blog/design-matters/2025/failure-isnt-the-end---its-where-better-services-begin
An easier way to manage vaccinations in schools,"<p>Helen Pitts shares a video walk-though of the new Manage vaccinations in schools (Mavis) service, which helps those involved in school vaccinations handle the challenging logistics of vaccinating hundreds of children in a single day.</p>

<p>Manage vaccinations in schools (shortened to Mavis) is a digital service we're building to support vaccination providers around the country, so that they’re easier to manage and more effective.</p>

<p>Vaccination providers visit schools to deliver vaccinations to hundreds of children in a single day. This can require a great deal of planning, preparing, and coordination.&nbsp;</p>","Digital Manage vaccinations in schools (shortened to Mavis) is a digital service we're building to support vaccination providers around the country, so that they’re easier to manage and more effective. Vaccination providers visit schools to deliver vaccinations to hundreds of children in a single day. This can require a great deal of planning, preparing, and coordination.  We've designed Mavis around the needs of the many different people who are involved in school vaccinations. From school administrators, nurses, parents and schoolchildren, everyone has a part to play, and we’ve worked hard to ensure the service works for all of them. It’s not always easy to visualise how one digital service can meet such varied needs. So, we've put together a short video using an anonymised example to show how it all fits together. We've carried out extensive user research with parents, children, nurses and admin staff. Their insights have shaped what the service does and how it works. Mavis aims to address known challenges including variable quality messaging and poor digital experiences. Both can negatively affect vaccination uptake issues  From the first message, “Your child is eligible for vaccination”, to data sharing and reporting, Mavis supports the whole user journey. It brings together parts of the service that are currently scattered across multiple systems and manual processes. It’s accessible for everyone, from medical professionals to families, on any device. No more PDFs buried in school newsletters with QR codes you can't scan! Mavis gives local teams direct control over communication with parents and saves them hours of admin. Parents can easily give consent online, without the hassle of paper forms  Mavis connects with NHS England systems, helping GPs and hospitals view school age vaccinations, reducing reporting workload.  If you have questions or comments, we'd love to hear them. Contact us on [email protected]. Martin Jarvis, Incident Management Lead in our Cyber Security Operations Centre (CSOC), explains how the preparedness of individual NHS organisations, working alongside central response capabilities, forms a protective partnership to keep the NHS safe. Joe and Pete explain the greater emphasis being placed on digital patient messaging across the NHS and the potential to provide a more seamless experience for patients, reduce the number of missed appointments and save the NHS money. Karol Kuczera and Max Marulli De Barletta reflect on their visit to Google’s Accessibility Discovery Centre and how inclusive technology can enable more equitable access to health, education and broader social participation. 
            Last edited: 13 August 2025 3:58 pm
        ","Wed, 13 Aug 2025 14:58:14 GMT",https://digital.nhs.uk/blog/transformation-blog/2025/an-easier-way-to-manage-vaccinations-in-schools
Why we are reinvesting in the NHS prototype kit,"<p>Frankie and Mike explain why we revived the NHS prototype kit, the benefits of prototyping in code and how digital teams in the NHS can get started using it.</p>

<p>The <a href=""http://prototype-kit.service-manual.nhs.uk/"">NHS prototype kit</a>&nbsp;was first developed in 2019 to make it easier for digital teams to rapidly design and test new digital services. It was inspired by the GOV.UK Prototype Kit and builds on the legacy of open-source public-sector design tools in the UK.</p>","Digital The NHS prototype kit was first developed in 2019 to make it easier for digital teams to rapidly design and test new digital services. It was inspired by the GOV.UK Prototype Kit and builds on the legacy of open-source public-sector design tools in the UK. Prototyping is central to delivering good products, platforms, and services. The process enables teams to gain robust insight from users, iterate design work quickly, and reliably deliver value to users. Done well, a design and development process rooted in iterative prototyping saves time and money by reducing the risk that we deliver the wrong thing. There are many tools available to design services, from paper prototypes to visual design drawing software like Figma, Sketch and Illustrator. Each has its benefits and drawbacks. Each can be useful in specific contexts. However, we are choosing to reinvest in the NHS prototype kit as the primary tool for the development of interactive prototypes that can be tested with users. The prototype kit has some big advantages over visual layout tools: For some designers, changing how they work from using visual tools like Figma to designing directly in code can be quite daunting. To make this transition easier, over the past year we've been looking at ways to make the NHS prototype kit easier to learn and use. We have refreshed and updated the website, with a new guide for installing the kit and a step by step tutorial for learning the basics. We’ve also added guidance on how to use the kit with GitHub Codespaces, which lets you run the kit in the cloud without the need to install any software. We’ve improved the kit itself by fixing some longstanding bugs, adding a new ‘reset data’ feature, and updating the page templates. To support our designers in learning how to use the NHS prototype kit, we are developing a new training course which will start in September 2025. If you work for the NHS and are interested, please get in touch. Help us improve The things we’d still like to improve are the process for updating the kit, the error messages produced when you make a typo in your code, and how the kit can best support prototyping for the NHS App and NHS.UK website. The NHS prototype kit is a community project with open-source code, and we welcome contributions from all who are interested in investing in this tool to help us all build better digital services for the NHS. Liz Glidewell explains why failing a GDS service assessment is a normal part of the improvement process – and how she supported the Be Part of Research team through multiple assessments to build a better, more accessible service for their users. Emma Swift and Zuzanna Lito explain how we've updated the NHS service standard to make sure teams building online services are more aware and responsive to the risks of domestic abuse and coercive control. Simon Davis explains how the NHS App team puts users at the heart of digital delivery design by considering accessibility needs at every ","Mon, 21 Jul 2025 13:38:08 GMT",https://digital.nhs.uk/blog/design-matters/2025/why-we-are-reinvesting-in-the-nhs-prototype-kit
A digital-first approach to patient communications,"<p>Joe and Pete explain the greater emphasis being placed on digital patient messaging across the NHS and the potential to provide a more seamless experience for patients, reduce the number of missed appointments and save the NHS money.&nbsp;</p>

<p>This week, the Secretary of State announced the start of our journey to becoming a ""digital first NHS"" – here is what it means for you.</p>

<p>In other aspects of our lives, it's second nature to receive messages digitally. Think online bank statements, email receipts for our online shopping or text messages confirming our home deliveries have arrived. But for various reasons, the NHS has found this challenging, and we still send out millions of letters to patients each year.</p>","Digital This week, the Secretary of State announced the start of our journey to becoming a ""digital first NHS"" – here is what it means for you. In other aspects of our lives, it's second nature to receive messages digitally. Think online bank statements, email receipts for our online shopping or text messages confirming our home deliveries have arrived. But for various reasons, the NHS has found this challenging, and we still send out millions of letters to patients each year. Recognising the need for change, we are working to adopt a digital-first approach, shifting from analogue to digital. The NHS App, text messages and emails will now be the main channels of communication for patients. ‘Digital-first’ patient messaging means using the NHS App, text message and email as the primary way to communicate with patients, relying less on letters. Whether it's an in-app reminder about an appointment or an email with health advice, digital messaging helps reach patients quickly and conveniently. Digital-first does not mean digital-only and we will continue to send letters to patients who need them. At the same time, we are expanding accessible communications such as braille and easy read. We are continually considering how to better reach all patients by ensuring NHS communications are more accessible and inclusive.  The NHS will shift towards using the NHS App as the primary channel for patient communication, followed by text messages, emails and letters. We are initially focusing on areas where we send a high volume of patient communications, such as vaccinations, screening, GP appointment reminders and questionnaires. In the coming year, breast, cervical, and bowel screening communications will all be sent via the NHS App for patients who have the app downloaded and notifications turned on. We will also continue to scale our roll-out to secondary care via patient engagement portals. This means connecting all acute and specialist trusts, and more mental health and community trusts to the NHS App.  In the last year alone, over 88 million messages were read in the NHS App. By the end of March 2026, we are aiming to send over 270 million messages digitally-first via the app.  We have already seen where the use of two-way communications via patient engagement portals and the NHS App is saving valuable clinician time. At Rotherham Hospital, they are sending preoperative triage questionnaires via the NHS App for all patients on surgical waiting lists. In doing so, they found that over a quarter of patients don't need a face-to-face pre-assessment. Instead, they can do a digital pre-assessment via the NHS App, saving 30 to 60 minutes of a nurse’s time.  Patients can be sent preoperative triage questionnaires via the NHS App The NHS App provides a simple and secure way for patients to access a range of NHS services. As the digital ‘front door’ to the NHS, the app is at the forefront of the shift from analogue to digital. To help this, we are continuing to ma","Mon, 09 Jun 2025 09:40:52 GMT",https://digital.nhs.uk/blog/transformation-blog/2025/a-digital-first-approach-to-patient-communications
Designing for inclusion: What we learned at Google,"<p>Karol Kuczera and&nbsp;Max Marulli De Barletta reflect on their visit to Google’s Accessibility Discovery Centre and how inclusive technology can enable more equitable access to health, education and broader social participation.</p>

<p>In today’s NHS, digital tools are central to how we deliver care, share information, and empower people to manage their health. But for those facing barriers to access – whether through disability, language or low digital confidence – these tools can just as easily widen inequalities as reduce them.</p>","Digital In today’s NHS, digital tools are central to how we deliver care, share information, and empower people to manage their health. But for those facing barriers to access – whether through disability, language or low digital confidence – these tools can just as easily widen inequalities as reduce them. Digital exclusion is one of the key factors of inequality in health. It intersects closely with poverty, education, ethnicity, and age. This is why, through the NHS Framework for Action on Digital Inclusion, and the Core20PLUS5 approach, coupled with digital design maturity, we’re committed to ensuring that digital transformation reduces – not reinforces – health inequalities. We’re looking beyond our own sector for models of good practice. Google’s Accessibility Discovery Centre (ADC) in London which inspired our own Accessibility Lab, offers one such example. While the ADC isn’t a health facility, the ethos behind it – creating immersive environments to better understand the needs of people with disabilities – reflects values we’re embedding across the NHS. We’ve applied similar thinking through the creation of our own Accessibility Lab in Leeds. The lab provides an interactive space for staff to explore assistive technologies, understand barriers faced by people with disabilities, and carry out basic accessibility checks. It plays a vital role in supporting teams to build more inclusive, user-centred services from the outset. The ADC brings together assistive technologies designed to support a wide range of access needs, including vision, hearing, mobility, speech and cognitive processing: These technologies are developed in partnership with organisations such as the Royal National Institute of Blind People (RNIB), the Royal National Institute for Deaf People (RNID), and individuals with lived experience. This model of co-production mirrors the user-centred approach we have embedded within NHS digital programmes. Digital transformation is one of the government’s 3 major shifts: moving services from analogue to digital to improve access, efficiency and responsiveness. In line with this shift, digital tools are playing an increasingly central role in how people engage with NHS services. But while digital services offer new opportunities, they must be designed inclusively. Without this, some people – particularly those with learning disabilities, sensory impairments or limited digital confidence – may face significant barriers. Inaccessible digital design doesn’t just create inconvenience; it risks deepening existing inequalities in access to care. That’s why the NHS Framework for Action on Digital Inclusion makes clear that while digital services should be expanded, non-digital options must always be retained to ensure fair and equitable access for all. There are already promising efforts across the NHS to tackle this. Inclusive design principles, user research and service design show that offering alternative routes is vital to equitable dig","Thu, 22 May 2025 13:03:15 GMT",https://digital.nhs.uk/blog/transformation-blog/2025/designing-for-inclusion-what-we-learned-at-google
Mitigating the risks of domestic abuse,"<p>Emma Swift and Zuzanna Lito explain how we've updated the NHS service standard to make sure teams building online services are more aware and responsive to the risks of domestic abuse and coercive control.</p>

<p>The <a href=""http://service-manual.nhs.uk/standards-and-technology/service-standard"">NHS service standard</a>&nbsp;helps teams build and run digital services that meet users’ needs. It's designed to improve patients’ care and experience when engaging with the NHS online.</p>

<p>The service standard has recently undergone some small but significant updates. The new updates are designed to make sure that teams building online services are more aware of and responsive to the risks of domestic abuse and coercive control.</p>","Digital The NHS service standard helps teams build and run digital services that meet users’ needs. It's designed to improve patients’ care and experience when engaging with the NHS online. The service standard has recently undergone some small but significant updates. The new updates are designed to make sure that teams building online services are more aware of and responsive to the risks of domestic abuse and coercive control. Domestic abuse and coercive control are pervasive issues that affect millions of people in England. An estimated 5% of people aged 16 years and over (6.6% of women and 3% of men) experienced domestic abuse in the year ending March 2024. This equates to an estimated 2.3 million adults in England (1.6 million women and 712,000 men).1 Coercive control, a form of psychological abuse, is also common. Perpetrators of domestic abuse and coercive control are increasingly using technology to abuse victims, with 1 in 3 women experiencing online harassment, according to a survey by the charity Refuge.2 Tactics include spreading false information, hacking accounts, using spyware, and tracking with GPS locators. This creates a constant sense of surveillance, leaving victims without privacy or safety. 1 Domestic abuse in England and Wales overview: November 2024 2 Refuge, Unsocial Spaces The need for new guidance became clear during our work to help patients nominate someone to manage their GP health services on their behalf, also known as 'proxy access'. Proxy access can be set up for someone who needs support with booking appointments or ordering prescriptions. Once the GP practice sets it up, the patient’s chosen person can do this via the NHS App. The National Proxy Service has worked hard to make sure that patients are safeguarded and that proxy access is reviewed by GP staff, acting on relevant guidance. As we consider the future of proxy access, it is important now to address the risk of technology-facilitated abuse and minimise this risk in the service design process. We collaborated with a group of user-centred design (UCD) and business analysis colleagues, who volunteered their time. The group has now grown, as more and more people wanted to make a difference. We were also joined by colleagues from NHS England’s domestic abuse and sexual violence programme. The service manual team, who manage the NHS service standard, interviewed service design teams and clinicians about their experience of considering the risks around tech abuse. We held collaborative workshops, consulted researchers in the area and reviewed the guidance that’s available. We decided to introduce some minor changes to the NHS service standard as the first step towards raising awareness and supporting our colleagues in digital product teams in identifying and mitigating the risks. Standard 9 on creating a secure service which protects users’ privacy now says: As we learned, empowering users with the right tools to control and manage their personal data is a k","Wed, 21 May 2025 09:38:33 GMT",https://digital.nhs.uk/blog/design-matters/2025/mitigating-the-risks-of-domestic-abuse
